{
  "receipt_version": "0.1",
  "run_id": "openpolicy-0bb35fd7-945e-44a2-a187-f95a8f9200c3",
  "generated_at": "2026-08-27T20:41:15.170Z",
  "action": "assemble_and_evaluate_link_only_oregon_release_slice",
  "actor": "Jewoong Moon",
  "authorization_scope": {
    "allowed_actions": [
      "read_release_inputs",
      "fetch_declared_sources",
      "write_release_audit"
    ],
    "network_access": true,
    "secrets_access": false
  },
  "code": {
    "repository": "https://github.com/Educatian/aiedobservatory",
    "commit": "73fd68d967a7a15cfe7e3b089ad6c0de3a3c1c3f",
    "dirty": true
  },
  "runtime": {
    "node": "v24.15.0",
    "platform": "win32-x64; 10.0.26200",
    "model_path": "deterministic_release_audit_no_model",
    "prompt_version": null
  },
  "inputs": [
    {
      "path": "data/release/v0.1/policy-claims.json",
      "sha256": "f30a471c14726a40ad051e68814935f56e3449e9215918cee28181e0c448c517",
      "bytes": 3255
    },
    {
      "path": "data/release/v0.1/source-rights.json",
      "sha256": "c0128535c2b48cd8a994a30cd554ade70306f5d48e38ef4d03e5298226f7067e",
      "bytes": 2498
    }
  ],
  "outputs": [
    {
      "path": "data/release/v0.1/source-integrity.json",
      "sha256": "7b4470a1d2e378ca8c5af7e24eab0f0f4f00b5b1edab22e6b3cead77c7a9dfbf",
      "bytes": 2451
    },
    {
      "path": "data/release/v0.1/evaluation-card.json",
      "sha256": "47f592bac2e66ac1fdfbd6e83b0d8b1df1ce3610611d138474a300a20b00034e",
      "bytes": 627
    }
  ],
  "review": {
    "status": "pending",
    "reviewer": null,
    "correction_or_retirement": null
  }
}